{
  "requestId": "REQ-2024-PAID-001",
  "status": "success",
  "timestamp": "2024-01-15T10:30:45.123Z",
  "searchMethod": "ClaimHistory",
  "totalResults": 1,
  "claims": [
    {
      "claimNumber": "CLM123456789",
      "patientAccountNumber": "PAT-2024-001",
      "claimStatus": "Paid",
      "claimStatusCode": "F2",
      "claimStatusCategory": "Finalized",
      "statusCode": "F2",
      "statusCodeDescription": "Claim has been finalized and paid",
      "serviceFromDate": "20240105",
      "serviceToDate": "20240105",
      "receivedDate": "20240107",
      "processedDate": "20240110",
      "finalizedDate": "20240110",
      "effectiveDate": "20240110",
      "exchangeDate": "2024-01-15T10:30:45.123Z",
      "paidDate": "20240112",
      "billedAmount": 850.00,
      "BILLED": 850.00,
      "allowedAmount": 650.00,
      "ALLOWED": 650.00,
      "paidAmount": 520.00,
      "INSURANCE_TOTAL_PAID": 520.00,
      "patientResponsibility": 130.00,
      "PATIENT_RESPONSIBILITY": 130.00,
      "COPAY": 30.00,
      "COINSURANCE": 65.00,
      "DEDUCTIBLE": 35.00,
      "DISCOUNT": 200.00,
      "adjustmentAmount": -200.00,
      "payerId": "PCHP",
      "payerName": "Parkland Community Health Plan",
      "providerId": "1234567890",
      "providerName": "Smith Medical Group",
      "memberId": "M123456",
      "memberName": "Doe, Jane",
      "checkNumber": "CHK789456123",
      "checkDate": "20240112",
      "remarkCodes": ["M80", "N428"],
      "reasonCodes": ["CO-45"],
      "code": ["CO-45", "M80", "N428"],
      "statusDetails": "Claim processed and paid. Check mailed on 2024-01-12",
      "comment": "Payment processed. Contractual adjustment applied per provider agreement.",
      "drgCode": "470",
      "facilityTypeCodeDescription": "Outpatient Hospital",
      "diagnosisCodes": ["J18.9", "R50.9", "J96.00"],
      "payeeName": "Smith Medical Group PA",
      "checkCashedDate": "20240115",
      "checkAmount": 520.00,
      "patient": {
        "lastName": "Doe",
        "firstName": "Jane",
        "middleName": "Marie",
        "suffix": "",
        "birthdate": "19850315",
        "memberId": "M123456",
        "gender": "F"
      },
      "subscriber": {
        "lastName": "Doe",
        "firstName": "John",
        "middleName": "Robert",
        "suffix": "",
        "memberId": "M123456",
        "groupNumber": "GRP789456"
      },
      "billingProvider": {
        "taxId": "12-3456789",
        "npi": "1234567890",
        "lastName": "Smith",
        "firstName": "David",
        "middleName": "Allen",
        "suffix": "MD"
      },
      "renderingProvider": {
        "taxId": "12-3456789",
        "npi": "9876543210",
        "lastName": "Johnson",
        "firstName": "Emily",
        "middleName": "Grace",
        "suffix": "DO"
      },
      "serviceLines": [
        {
          "fromDate": "20240105",
          "toDate": "20240105",
          "diagnosisCodes": ["J18.9", "R50.9"],
          "procedureCode": "99214",
          "modifiers": ["25"],
          "quantity": 1,
          "DEDUCTIBLE": 35.00,
          "DISCOUNT": 50.00,
          "COPAY": 30.00,
          "COINSURANCE": 20.00,
          "PATIENT_RESPONSIBILITY": 85.00
        },
        {
          "fromDate": "20240105",
          "toDate": "20240105",
          "diagnosisCodes": ["J96.00"],
          "procedureCode": "94060",
          "modifiers": [],
          "quantity": 1,
          "DEDUCTIBLE": 0.00,
          "DISCOUNT": 150.00,
          "COPAY": 0.00,
          "COINSURANCE": 45.00,
          "PATIENT_RESPONSIBILITY": 45.00
        }
      ],
      "eligibleForAttachment": false,
      "eligibleForChat": false,
      "eligibleForCorrection": false,
      "eligibleForMessaging": true,
      "eligibleForAppeal": false,
      "eligibleForRemittanceViewer": true,
      "appealMessage": null,
      "appealType": null,
      "appealTimelyFilingDate": null
    }
  ]
}
